{
   "name": "JobStructure",
   "title": "JobStructure",
   "description": "Job structure refers to information about job classication and job function.",
   "shortDescription": "Job structure refer to info about job classification and job function.",
   "partOfPackage": "sap.sf.foundationobjects:package:DataProducts:v1.0.0",
   "version": "1.0.0",
   "type": "primary",
   "responsible": "sap:ach:LOD-SF-EC",
   "category": "business-object",
   "entityTypes": [
      "sap.odm:entityType:JobClassification:v1",
      "sap.odm:entityType:JobFunction:v1",
      "sap.sf.foundationobjects:entityType:jobClassification:v1",
      "sap.sf.foundationobjects:entityType:jobFunction:v1"
   ],
   "datasets": [
      "sap.sf.foundationobjects:dataset:JobStructure:v1.0.0"
   ],
   "shares": [
      "sap.sf.foundationobjects:share:JobStructure:v1.0.0"
   ]
}