{
   "name": "Course",
   "title": "Course",
   "description": "Includes all the information for an item[Entity]",
   "shortDescription": "Includes all information for an item.",
   "partOfPackage": "sap.sf.learning:package:DataProducts:v1.0.0",
   "version": "1.0.0",
   "type": "primary",
   "responsible": "sap:ach:LOD-SF-LMS",
   "category": "business-object",
   "entityTypes": [
      "sap.sf.learning:entityType:course:v1"
   ],
   "datasets": [
      "sap.sf.learning:dataset:Course:v1.0.0"
   ],
   "shares": [
      "sap.sf.learning:share:Course:v1.0.0"
   ]
}